{
 "format": "sonara.project",
 "schema_version": 1,
 "id": "prj_000000000001",
 "name": "Rich ✓ Ünïcode",
 "settings": {
  "sample_rate": 44100,
  "length_beats": 64.0,
  "record_subtype": "FLOAT"
 },
 "tempo_map": [
  {
   "beat": 0.0,
   "bpm": 128.0,
   "ramp": true
  },
  {
   "beat": 16.0,
   "bpm": 96.5,
   "ramp": false
  },
  {
   "beat": 32.0,
   "bpm": 140.0,
   "ramp": false
  }
 ],
 "time_signatures": [
  {
   "bar": 0,
   "numerator": 4,
   "denominator": 4
  },
  {
   "bar": 4,
   "numerator": 7,
   "denominator": 8
  }
 ],
 "tracks": [
  {
   "id": "trk_fld",
   "name": "Rhythm",
   "kind": "folder",
   "color": "#aa0000",
   "output_id": "master",
   "parent_id": null,
   "mixer": {
    "volume_db": 0.0,
    "pan": 0.0,
    "mute": false,
    "solo": false,
    "solo_safe": false
   },
   "input": {
    "channels": [
     0
    ],
    "armed": false,
    "monitor": "auto"
   },
   "instrument": null,
   "inserts": [],
   "sends": [],
   "automation": [],
   "clips": []
  },
  {
   "id": "trk_drm",
   "name": "Drums",
   "kind": "instrument",
   "color": null,
   "output_id": "master",
   "parent_id": "trk_fld",
   "mixer": {
    "volume_db": 0.0,
    "pan": 0.0,
    "mute": false,
    "solo": false,
    "solo_safe": false
   },
   "input": {
    "channels": [
     0
    ],
    "armed": false,
    "monitor": "auto"
   },
   "instrument": {
    "id": "dev_drm",
    "plugin_id": "sonara.drums",
    "name": "Kit",
    "enabled": true,
    "params": {},
    "sidechain_id": null,
    "preset": null,
    "state": {}
   },
   "inserts": [],
   "sends": [],
   "automation": [],
   "clips": []
  },
  {
   "id": "trk_bas",
   "name": "Bass",
   "kind": "instrument",
   "color": null,
   "output_id": "trk_bus",
   "parent_id": "trk_fld",
   "mixer": {
    "volume_db": -4.5,
    "pan": -0.25,
    "mute": false,
    "solo": true,
    "solo_safe": false
   },
   "input": {
    "channels": [
     1
    ],
    "armed": true,
    "monitor": "on"
   },
   "instrument": {
    "id": "dev_syn",
    "plugin_id": "sonara.synth.poly",
    "name": "Synth",
    "enabled": true,
    "params": {
     "filter_cutoff": 1234.5,
     "unison": 3,
     "voice_mode": "mono",
     "glide": 0.0
    },
    "sidechain_id": null,
    "preset": "Analog Bass",
    "state": {}
   },
   "inserts": [
    {
     "id": "dev_cmp",
     "plugin_id": "sonara.dynamics.compressor",
     "name": "Comp",
     "enabled": true,
     "params": {
      "threshold_db": -24.0,
      "sidechain": true
     },
     "sidechain_id": "trk_drm",
     "preset": null,
     "state": {}
    },
    {
     "id": "dev_eq",
     "plugin_id": "sonara.eq.parametric",
     "name": "EQ",
     "enabled": false,
     "params": {
      "low_gain": -1.5
     },
     "sidechain_id": null,
     "preset": null,
     "state": {}
    }
   ],
   "sends": [
    {
     "id": "snd_1",
     "target_id": "trk_bus",
     "level_db": -9.0,
     "pre_fader": true,
     "enabled": false
    }
   ],
   "automation": [
    {
     "id": "aut_vol",
     "target": {
      "device_id": null,
      "param": "volume_db"
     },
     "enabled": true,
     "points": [
      {
       "beat": 0.0,
       "value": -6.0,
       "curve": "smooth"
      },
      {
       "beat": 8.0,
       "value": 0.0,
       "curve": "linear"
      }
     ]
    },
    {
     "id": "aut_cut",
     "target": {
      "device_id": "dev_syn",
      "param": "filter_cutoff"
     },
     "enabled": false,
     "points": [
      {
       "beat": 4.0,
       "value": 200.0,
       "curve": "hold"
      },
      {
       "beat": 6.0,
       "value": 8000.0,
       "curve": "linear"
      }
     ]
    },
    {
     "id": "aut_snd",
     "target": {
      "device_id": null,
      "param": "send.snd_1.level_db"
     },
     "enabled": true,
     "points": [
      {
       "beat": 1.0,
       "value": -12.0,
       "curve": "linear"
      }
     ]
    }
   ],
   "clips": [
    {
     "type": "midi",
     "id": "clp_bass",
     "name": "Bass Line",
     "start": 4.0,
     "length": 8.0,
     "content_offset": 0.5,
     "loop_length": 4.0,
     "muted": false,
     "color": "#123abc",
     "notes": [
      {
       "id": "n_1",
       "pitch": 36,
       "start": 0.0,
       "length": 0.5,
       "velocity": 120,
       "channel": 0
      },
      {
       "id": "n_2",
       "pitch": 43,
       "start": 0.3333333333333333,
       "length": 0.6666666666666666,
       "velocity": 90,
       "channel": 2
      },
      {
       "id": "n_3",
       "pitch": 48,
       "start": 2.75,
       "length": 1.25,
       "velocity": 1,
       "channel": 0
      }
     ],
     "controls": [
      {
       "beat": 0.5,
       "kind": "cc",
       "number": 11,
       "value": 64,
       "channel": 0
      },
      {
       "beat": 1.0,
       "kind": "pitch_bend",
       "number": 0,
       "value": -8192,
       "channel": 0
      },
      {
       "beat": 2.0,
       "kind": "channel_pressure",
       "number": 0,
       "value": 70,
       "channel": 3
      }
     ]
    }
   ]
  },
  {
   "id": "trk_vox",
   "name": "Vocals",
   "kind": "audio",
   "color": null,
   "output_id": "master",
   "parent_id": null,
   "mixer": {
    "volume_db": 0.0,
    "pan": 0.0,
    "mute": true,
    "solo": false,
    "solo_safe": true
   },
   "input": {
    "channels": [
     0
    ],
    "armed": false,
    "monitor": "auto"
   },
   "instrument": null,
   "inserts": [],
   "sends": [],
   "automation": [],
   "clips": [
    {
     "type": "audio",
     "id": "clp_vox",
     "name": "Vox",
     "asset_id": "med_vox",
     "start": 2.0,
     "length": 3.5,
     "source_offset": 1200,
     "gain_db": -3.25,
     "fade_in": {
      "seconds": 0.01,
      "curve": "equal_power"
     },
     "fade_out": {
      "seconds": 0.2,
      "curve": "s_curve"
     },
     "muted": true,
     "color": null
    }
   ]
  },
  {
   "id": "trk_bus",
   "name": "Verb",
   "kind": "bus",
   "color": null,
   "output_id": "master",
   "parent_id": null,
   "mixer": {
    "volume_db": -144.0,
    "pan": 0.0,
    "mute": false,
    "solo": false,
    "solo_safe": false
   },
   "input": {
    "channels": [
     0
    ],
    "armed": false,
    "monitor": "auto"
   },
   "instrument": null,
   "inserts": [
    {
     "id": "dev_ir",
     "plugin_id": "sonara.convolver",
     "name": "IR",
     "enabled": true,
     "params": {},
     "sidechain_id": null,
     "preset": null,
     "state": {
      "ir_asset_id": "med_vox",
      "nested": {
       "a": [
        1,
        2
       ]
      }
     }
    }
   ],
   "sends": [],
   "automation": [],
   "clips": []
  }
 ],
 "master": {
  "id": "master",
  "name": "Master",
  "kind": "master",
  "color": null,
  "output_id": null,
  "parent_id": null,
  "mixer": {
   "volume_db": -0.5,
   "pan": 0.0,
   "mute": false,
   "solo": false,
   "solo_safe": false
  },
  "input": {
   "channels": [
    0
   ],
   "armed": false,
   "monitor": "auto"
  },
  "instrument": null,
  "inserts": [
   {
    "id": "dev_lim",
    "plugin_id": "sonara.dynamics.limiter",
    "name": "Lim",
    "enabled": true,
    "params": {},
    "sidechain_id": null,
    "preset": null,
    "state": {}
   }
  ],
  "sends": [],
  "automation": [],
  "clips": []
 },
 "assets": [
  {
   "id": "med_vox",
   "kind": "audio",
   "name": "vox.wav",
   "path": "media/audio/med_vox-vox.wav",
   "location": "embedded",
   "size_bytes": 144044,
   "sha256": "0000000000000000000000000000000000000000000000000000000000000000",
   "sample_rate": 48000,
   "channels": 2,
   "frames": 24000,
   "format": "WAV",
   "subtype": "PCM_24",
   "original_path": "/original/vox.wav",
   "relative_hint": null,
   "metadata": {
    "title": "Vox"
   }
  }
 ],
 "markers": [
  {
   "id": "mrk_1",
   "beat": 16.0,
   "name": "Drop",
   "color": "#00ff00"
  }
 ],
 "sections": [
  {
   "id": "sec_i",
   "name": "Intro",
   "start": 0.0,
   "length": 16.0,
   "color": null
  },
  {
   "id": "sec_v",
   "name": "Verse",
   "start": 16.0,
   "length": 16.0,
   "color": "#0000ff"
  }
 ],
 "transport": {
  "loop_enabled": true,
  "loop_start": 4.0,
  "loop_end": 12.0,
  "punch_enabled": true,
  "punch_in": 2.0,
  "punch_out": 6.0,
  "metronome": true,
  "count_in_bars": 2
 },
 "metadata": {
  "title": "Title",
  "artist": "Artist",
  "album": "Album",
  "genre": "Genre",
  "composer": "Composer",
  "comment": "Comment",
  "created": "2026-10-20T00:00:00Z",
  "modified": ""
 },
 "editor": {
  "zoom": 1.5,
  "snap": "1/16",
  "heights": {
   "trk_bas": 80
  }
 }
}
